01100;Almirante
01100;Almirante de la armada nacional
01100;Brigadier general
01100;Brigadier general de infantería de marina
01100;Brigadier general del ejercito nacional
01100;Brigadier general fuerza aérea
01100;Cadete de la fuerza aérea
01100;Cadete de las fuerzas armadas
01100;Cadete del ejercito nacional
01100;Capitán de corbeta de la armada nacional
01100;Capitán de fragata de la armada nacional
01100;Capitán de infantería de marina
01100;Capitán de la fuerza aérea
01100;Capitán de navío de la armada nacional
01100;Capitán del ejército nacional
01100;Comandante armada
01100;Comandante base armada
01100;Comandante batallón ejército
01100;Comandante brigada armada
01100;Comandante brigada ejército
01100;Comandante ejército
01100;Comandante fuerza aérea
01100;Comandante unidad ejército
01100;Comandante unidad fuerza aérea
01100;Contralmirante
01100;Contralmirante de la armada nacional
01100;Coronel de infantería de marina
01100;Coronel del ejército nacional
01100;Coronel fuerza aérea
01100;General de infantería de marina
01100;General del ejército nacional
01100;General fuerza aérea
01100;Guardiamarina
01100;Mayor
01100;Mayor de infantería de marina
01100;Mayor de la fuerza aérea
01100;Mayor del ejército nacional
01100;Mayor general
01100;Mayor general de infantería de marina
01100;Mayor general del ejército nacional
01100;Mayor general fuerza aérea
01100;Oficial de la armada nacional
01100;Oficial del ejército nacional
01100;Oficial fuerza aérea
01100;Oficial fuerzas militares
01100;Segundo comandante ejército nacional
01100;Segundo comandante fuerza aérea colombiana
01100;Subcomandante armada nacional
01100;Subteniente de infantería de marina
01100;Subteniente del ejército nacional
01100;Subteniente fuerza aérea
01100;Teniente coronel de infantería de marina
01100;Teniente coronel de la fuerza aérea
01100;Teniente coronel del ejército nacional
01100;Teniente de corbeta de la armada nacional
01100;Teniente de fragata de la armada nacional
01100;Teniente de infantería de marina
01100;Teniente de navío de la armada nacional
01100;Teniente del ejército nacional
01100;Teniente fuerza aérea
01100;Vicealmirante
01100;Vicealmirante de la armada nacional
02100;Aerotécnico de la fuerza aérea
02100;Cabo primero de infantería de marina
02100;Cabo primero del ejército nacional
02100;Cabo segundo de infantería de marina
02100;Cabo segundo del ejército nacional
02100;Cabo tercero de infantería de marina
02100;Cabo tercero del ejército nacional
02100;Contramaestre de marina
02100;Contramaestre militar
02100;Marinero de la armada
02100;Marinero primero de la armada nacional
02100;Marinero segundo de la armada nacional
02100;Sargento del ejército
02100;Sargento mayor de comando conjunto de infantería de marina
02100;Sargento mayor de comando conjunto del ejército nacional
02100;Sargento mayor de comando de infantería de marina
02100;Sargento mayor de comando del ejército
02100;Sargento mayor de infantería de marina
02100;Sargento mayor del ejército nacional
02100;Sargento primero de infantería de marina
02100;Sargento primero del ejército nacional
02100;Sargento segundo de infantería de marina
02100;Sargento segundo del ejército nacional
02100;Sargento viceprimero del ejército nacional
02100;Suboficial de la armada
02100;Suboficial de la fuerza aérea
02100;Suboficial de las fuerzas militares
02100;Suboficial del ejército
02100;Suboficial jefe de la armada nacional
02100;Suboficial jefe técnico de comando conjunto de la armada nacional
02100;Suboficial jefe técnico de comando de la armada nacional
02100;Suboficial jefe técnico de la armada nacional
02100;Suboficial primero de la armada nacional
02100;Suboficial segundo de la armada nacional
02100;Suboficial tercero de la armada nacional
02100;Técnico cuarto de la fuerza aérea
02100;Técnico jefe de comando conjunto de la fuerza aérea
02100;Técnico jefe de comando de las fuerzas armadas
02100;Técnico jefe de la fuerza aérea
02100;Técnico primero de la fuerza aérea
02100;Técnico segundo de la fuerza aérea
02100;Técnico subjefe de la fuerza aérea
02100;Técnico tercero de la fuerza aérea
03100;Alumno de infantería de marina
03100;Artillero
03100;Bombardero
03100;Dragoneante
03100;Grumete
03100;Grumete infantería de marina
03100;Infante de marina
03100;Infante de marina profesional
03100;Infante de marina regular
03100;Operador de radio militar
03100;Soldado
03100;Soldado bachiller
03100;Soldado campesino
03100;Soldado de infantería
03100;Soldado ejército
03100;Soldado fuerza aérea
03100;Soldado profesional
03100;Soldado profesional armada
03100;Soldado profesional del ejército nacional
03100;Soldado recluta
03100;Soldado regular
03100;Soldado regular del ejército nacional
03100;Soldado regular fuerza aérea
11110;Alcalde
11110;Canciller
11110;Concejal
11110;Congresista
11110;Diputado
11110;Edil
11110;Gobernador
11110;Gobernador de departamento
11110;Jefe de estado
11110;Legislador
11110;Miembro de gobiernos locales
11110;Miembro de la asamblea legislativa
11110;Miembro del consejo legislativo
11110;Miembro del parlamento
11110;Miembro del poder ejecutivo
11110;Miembro del poder ejecutivo y legislativo
11110;Miembro del poder legislativo
11110;Ministro de gobierno
11110;Ministro de relaciones exteriores
11110;Parlamentario
11110;Presidente de la república
11110;Representante de la cámara
11110;Senador
11110;Viceministro de gobierno
11110;Vicepresidente de la república
11120;Administrador general administración pública
11120;Agregado de prensa
11120;Agregado diplomático
11120;Alguacil jefe de policía
11120;Alto comisionado
11120;Brigadier general policía nacional
11120;Comisionado de bomberos
11120;Comisionado de la función pública
11120;Consejero de estado
11120;Cónsul
11120;Contador general de la nación
11120;Contralor general de la nación
11120;Contralor general de la república
11120;Director aduana servicios gubernamentales
11120;Director de asuntos intergubernamentales
11120;Director de departamento administrativo nacional
11120;Director de impuestos nacionales
11120;Director de programas de desarrollo económico de servicios gubernamentales
11120;Director de programas de política educativa de servicios gubernamentales
11120;Director de relaciones intergubernamentales
11120;Director ejecutivo administración pública ministerio
11120;Director ejecutivo administración pública regional
11120;Director ejecutivo de administración pública
11120;Director ejecutivo de cancillería
11120;Director ejecutivo de servicios gubernamentales
11120;Director general de administración pública
11120;Director general de departamento gubernamental
11120;Director general de impuestos y aduanas
11120;Director general de organización intergubernamental
11120;Director general de servicios gubernamentales
11120;Director general impuestos
11120;Director políticas y programas administración pública
11120;Director unidad administrativa especial
11120;Director unidad nacional de bomberos
11120;Embajador
11120;Fiscal general de la nación
11120;Gerente general de servicios gubernamentales
11120;Inspector general de la policía
11120;Jefe departamento administración pública
11120;Mayor general policía nacional
11120;Personal directivo de la administración pública
11120;Personero
11120;Procurador general de la nación
11120;Registrador nacional del estado civil
11120;Secretario de estado
11120;Secretario general de administración pública
11120;Subsecretario de gobierno
11120;Superintendente nacional
11120;Tesorero general de la nación
11120;Tesorero general de la república
11120;Vicecontralor
11130;Gobernador de comunidad indígena
11130;Jefe de comunidad indígena
11130;Jefe de etnia indígena
11130;Jefe de pueblo
11130;Jefe tradicional de pequeña población
11140;Defensor del pueblo
11140;Director asociación de profesionales
11140;Director asociación deportiva
11140;Director de establecimiento adaptación social
11140;Director de organización electoral
11140;Director de organización no gubernamental
11140;Director de partido político
11140;Director ejecutivo asociación de profesionales
11140;Director ejecutivo de organización de membrecía
11140;Director ejecutivo de organización no gubernamental
11140;Director ejecutivo de organización voluntariado
11140;Director ejecutivo organización de membresía
11140;Director general de asociación deportiva
11140;Director general de organización de empleadores
11140;Director general de organización de membrecía
11140;Director general de organización humanitaria
11140;Director general de organización política
11140;Director general organización de membresía
11140;Dirigente de organización de empleadores
11140;Dirigente de organización humanitaria
11140;Dirigente de organización sindical
11140;Dirigente de partido político
11140;Líder de partido político
11140;Presidente club deportivo
11140;Presidente de asociación científica
11140;Presidente de asociación deportiva
11140;Presidente de club deportivo profesional
11140;Presidente de comité de derechos humanos
11140;Presidente de organización gremial
11140;Presidente de organización humanitaria
11140;Presidente de organización sindical
11140;Presidente de partido político
11140;Presidente de sindicato
11140;Secretario general de organización de derechos humanos
11140;Secretario general de organización de empleadores
11140;Secretario general de organización de protección del medio ambiente
11140;Secretario general de organización humanitaria
11140;Secretario general de organización sindical
11140;Secretario general de partido político
11200;Administrador general de acueducto
11200;Administrador general de aeropuerto
11200;Administrador general de oficina de aduana
11200;Administrador general de oficina de impuestos
11200;Comandante de estación de bomberos
11200;Delegado regional de bomberos
11200;Director de regional
11200;Director ejecutivo empresas de comercios medios de comunicación
11200;Director ejecutivo entidades financieras de telecomunicaciones
11200;Director general
11200;Director general comercio medios de comunicación
11200;Director general de clínica
11200;Director general de empresa
11200;Director general de empresa de comercio
11200;Director general de empresa de telecomunicaciones
11200;Director general de entidad financiera
11200;Director general de entidad promotora de salud
11200;Director general de hospital
11200;Director general de institución de servicios salud
11200;Director general de institución educativa
11200;Director general de organización de salud
11200;Director general de organización de servicio social
11200;Director general empresas manufactureras de construcción y transporte
11200;Director general entidades financieras de telecomunicaciones
11200;Director general industria manufacturera
11200;Director general institución correccional
11200;Director general institución penitenciaria
11200;Director general ventas empresas de comercio medios de comunicación
11200;Director general ventas empresas manufactureras de construcción y transporte
11200;Gerente general
11200;Gerente general cadena de almacenes
11200;Gerente general compañía minera
11200;Gerente general de almacenes de cadena
11200;Gerente general de cadena hotelera
11200;Gerente general de cadena radial
11200;Gerente general de cadena restaurantes
11200;Gerente general de compañía constructora
11200;Gerente general de compañía de seguros
11200;Gerente general de compañía de servicios de informática
11200;Gerente general de compañía de viajes y turismo
11200;Gerente general de compañía fiduciaria
11200;Gerente general de empresa de agroindustrial
11200;Gerente general de empresa de comercio
11200;Gerente general de empresa de construcción
11200;Gerente general de empresa de metalmecánica
11200;Gerente general de empresa de servicios de salud
11200;Gerente general de empresa de servicios informáticos
11200;Gerente general de empresa de telecomunicaciones
11200;Gerente general de empresa de teléfonos
11200;Gerente general de empresa de transporte
11200;Gerente general de entidad financiera
11200;Gerente general de entidad hospitalaria
11200;Gerente general de entidad promotora salud
11200;Gerente general de industria manufacturera
11200;Gerente general de servicios financieros y de telecomunicaciones
11200;Gerente general de tienda por departamentos
11200;Gerente general de ventas en empresas de comercio medios de comunicación
11200;Gerente general editorial
11200;Gerente general empresa de acueducto
11200;Gerente general empresa de distribución de gas
11200;Gerente general empresa de energía
11200;Gerente general empresa de servicio público
11200;Gerente general empresa pesquera
11200;Gerente general empresas de comercio medios de comunicación
11200;Gerente general empresas manufactureras de construcción y transporte
11200;Gerente general entidades financieras de telecomunicaciones
11200;Gerente general hotel
11200;Gerente general organización hotelera
11200;Gerente general producción de bienes servicios públicos transporte y construcción
11200;Gerente regional
11200;Presidente de banco
11200;Presidente de compañía constructora
11200;Presidente de compañía de seguros
11200;Presidente de empresa
11200;Presidente de empresa de radio y televisión
11200;Presidente de empresa de telecomunicaciones
11200;Presidente de empresa de transporte
11200;Presidente de empresa manufacturera
11200;Presidente de entidad financiera
11200;Presidente de medios de comunicación
11200;Presidente empresa de comercio
11200;Presidente empresas de comercio medios de comunicación
11200;Presidente empresas manufactureras de construcción y transporte
11200;Presidente entidades financieras de telecomunicaciones
11200;Rector de universidad
11200;Vicepresidente banca corporativa
11200;Vicepresidente de cadena de hoteles
11200;Vicepresidente de compañía aérea
11200;Vicepresidente de compañía constructora
11200;Vicepresidente de compañía petrolera
11200;Vicepresidente de empresa de radio y televisión
11200;Vicepresidente de empresa de telecomunicaciones
11200;Vicepresidente de empresa de transporte
11200;Vicepresidente de empresa manufacturera
11200;Vicepresidente de entidad de salud
11200;Vicepresidente de operaciones empresas manufactureras de construcción y transporte
11200;Vicepresidente de producción empresas manufactureras de construcción y transporte
11200;Vicepresidente de recursos humanos entidades de salud educación y organizaciones de membresía
11200;Vicepresidente empresa de comercio
11200;Vicepresidente empresas de comercio medios de comunicación
11200;Vicepresidente empresas manufactureras de construcción y transporte
11200;Vicepresidente entidades financieras de telecomunicaciones
11200;Vicepresidente financiero y administrativo entidades de salud educación y organizaciones de membresía
11200;Vicepresidente general administrativo de empresa
11200;Vicerrector académico de universidad
12111;Director administrativo y financiero
12111;Director de departamento de contabilidad
12111;Director de departamento de financiero
12111;Director de departamento de finanzas
12111;Director de finanzas
12111;Director de fondos y pagos
12111;Director de planeación financiera
12111;Director de presupuesto y contabilidad
12111;Director departamento de auditoría y control financiero
12111;Director financiero
12111;Director general de contabilidad
12111;Director presupuesto
12111;Gerente administrativo y financiero
12111;Gerente de control financiero
12111;Gerente de departamento financiero
12111;Gerente de firma de auditoría financiera
12111;Gerente de firma de contadores
12111;Gerente de operaciones de servicios estadísticos financieros
12111;Gerente financiero
12111;Gerente servicios de investigación de mercados financieros
12111;Gerente servicios de nómina
12111;Jefe contabilidad
12111;Jefe control interno financiero
12111;Jefe de control financiero
12111;Jefe de costos y presupuesto
12111;Jefe de departamento de auditoria financiera
12111;Jefe de departamento de cartera
12111;Jefe de departamento de contabilidad
12111;Jefe de departamento de costos
12111;Jefe de departamento de financiero
12111;Jefe de departamento de presupuesto
12111;Jefe de departamento de tesorería
12111;Jefe de departamento de tesorería y cartera
12111;Jefe de entidades financieras
12111;Jefe de operaciones de investigación de mercados financieros
12111;Jefe de tesorería
12111;Jefe financiero
12111;Jefe tesorería y cartera
12111;Secretario general financiero de empresa
12111;Subgerente administrativo y financiero
12111;Subgerente financiero
12111;Tesorero
12111;Tesorero general de la empresa
12111;Tesorero municipal
12111;Tesorero pagador
12111;Vicepresidente financiero y administrativo empresas de comercio medios de comunicación
12111;Vicepresidente financiero y administrativo empresas manufactureras de construcción y transporte
12111;Vicepresidente financiero y administrativo entidades financieras de telecomunicaciones
12111;Vicepresidente financiero y jurídico
12112;Gerente bienes raíces
12112;Gerente corretaje financiero
12112;Gerente de departamento de corretaje financiero
12112;Gerente de empresa de servicios de intermediación financiera
12112;Gerente de operaciones de propiedad raíz
12112;Gerente de operaciones de seguros
12112;Gerente departamento actuarial
12112;Gerente propiedad raíz
12112;Gerente seguros
12112;Gerente seguros bienes raíces y corretaje financiero
12112;Gerente seguros de vida
12112;Jefe de departamento de seguros y finanzas
12112;Jefe seguros y finanzas
12113;Administrador portafolio de inversiones
12113;Director de departamento de crédito
12113;Director de departamento de operaciones servicios tarjeta crédito
12113;Director de operaciones bancarias
12113;Director servicios tarjeta de crédito
12113;Gerente banca crédito e inversiones
12113;Gerente comercial banca empresarial
12113;Gerente corporación financiera
12113;Gerente crédito
12113;Gerente cuenta banca
12113;Gerente de crédito hipotecario
12113;Gerente de operaciones de banca
12113;Gerente de operaciones de servicios de investigación de mercados
12113;Gerente inversión bancaria
12113;Gerente inversión fiduciaria
12113;Gerente servicio al cliente institución financiera
12113;Jefe crédito y cartera
12113;Jefe de departamento de crédito
12113;Jefe de departamento de crédito y cartera
12113;Jefe de departamento de portafolio de inversiones financiera
12113;Jefe de sección de fiduciaria
12113;Jefe servicio al cliente institución financiera
12113;Subgerente comercial de banca personal
12113;Vicepresidente administrativo banca
12113;Vicepresidente comercial entidades financieras
12113;Vicepresidente de mercadeo entidades financieras de telecomunicaciones
12113;Vicepresidente de operaciones de banca
12113;Vicepresidente de operaciones entidades financieras de telecomunicaciones
12113;Vicepresidente de producción entidades financieras de telecomunicaciones
12120;Director de contratación
12120;Director de departamento de desarrollo de personal
12120;Director de departamento de gestión humana
12120;Director de departamento de seguridad industrial
12120;Director de departamento de selección personal
12120;Director de personal
12120;Director de recursos humanos
12120;Director de relaciones industriales
12120;Director de relaciones laborales
12120;Director desarrollo de personal
12120;Director en talento humano
12120;Director seguridad industrial
12120;Gerente de gestión humana
12120;Gerente de recursos humanos
12120;Gerente de relaciones industriales
12120;Gerente de talento humano
12120;Gerente HSEQ
12120;Jefe bienestar social
12120;Jefe de admisiones y registro de personal
12120;Jefe de bienestar recursos humanos
12120;Jefe de capacitación
12120;Jefe de compensación y beneficios
12120;Jefe de departamento de bienestar social
12120;Jefe de departamento de capacitación
12120;Jefe de departamento de capacitación y desarrollo personal
12120;Jefe de departamento de personal
12120;Jefe de departamento de recursos humanos
12120;Jefe de departamento de relaciones industriales
12120;Jefe de departamento de relaciones laborales
12120;Jefe de departamento de salud ocupacional
12120;Jefe de departamento de selección personal
12120;Jefe de desarrollo organizacional
12120;Jefe de evaluación
12120;Jefe de gestión humana
12120;Jefe de personal
12120;Jefe de recursos humanos
12120;Jefe de relaciones industriales
12120;Jefe de salud y seguridad ocupacional
12120;Jefe de selección
12120;Jefe de talento humano
12120;Jefe en prevención de riesgos laborales
12120;Jefe HSEQ
12120;Jefe oficina de personal
12120;Jefe relaciones laborales
12120;Jefe unidad de personal
12120;Subgerente de gestión humana
12120;Vicepresidente de departamento de recursos humanos
12120;Vicepresidente de departamento gestión humana
12120;Vicepresidente de recursos humanos
12120;Vicepresidente de talento humano
12120;Vicepresidente gestión humana
12130;Coordinador de política de gobierno
12130;Director análisis de política económica
12130;Director de planeación empresarial
12130;Director de planeación estratégica
12130;Director de planeación social
12130;Director de política pública
12130;Director de política y planeación
12130;Director políticas de impuestos
12130;Gerente de desarrollo de políticas
12130;Gerente programas de política de desarrollo económico
12191;Director de departamento de limpieza
12191;Director de servicios de limpieza
12191;Gerente mantenimiento
12191;Jefe de Mantenimiento e Infraestructura
12191;Jefe de Mantenimiento Locativo
12191;Jefe departamento mantenimiento industrial
12191;Jefe mantenimiento
12191;Jefe servicios de apoyo mantenimiento
12199;Administrador de empresa
12199;Director administrativo
12199;Director ambiental
12199;Director de gestión ambiental
12199;Director de servicios a empresas
12199;Director de servicios administrativos
12199;Director de servicios corporativos
12199;Director departamento administrativo
12199;Director departamento de seguridad
12199;Gerente administrativo
12199;Gerente ambiental
12199;Gerente de otros servicios administrativos
12199;Gerente servicios administrativos
12199;Jefe administrativo
12199;Jefe admisiones y registro
12199;Jefe departamento seguridad
12199;Jefe servicios administrativos
12199;Subdirector administrativo
12199;Subgerente administrativo
12211;Director comercial
12211;Director comercial ventas
12211;Director comercialización
12211;Director de departamento comercial
12211;Director de departamento de desarrollo comercial
12211;Director de departamento de marketing
12211;Director de departamento de servicios investigación mercados
12211;Director de departamento de ventas y mercadeo
12211;Director de mercadeo
12211;Director de telemercadeo
12211;Director de ventas
12211;Director desarrollo comercial
12211;Director mercadeo y ventas
12211;Director servicios de investigación mercados
12211;Gerente comercial
12211;Gerente comercial ventas
12211;Gerente de mercadeo
12211;Gerente de telemercadeo
12211;Gerente de ventas
12211;Gerente mercadeo y ventas
12211;Gerente nacional de ventas
12211;Gerente regional de ventas
12211;Gerente ventas mercadeo y publicidad
12211;Jefe de departamento de comercialización
12211;Jefe de departamento de comercio
12211;Jefe de departamento de mercadeo
12211;Jefe de departamento de mercadeo y ventas
12211;Jefe de departamento de promoción y comercialización
12211;Jefe de sección de ventas de comercio al por mayor
12211;Jefe departamento comercio al por menor
12211;Jefe investigación de mercados
12211;Jefe mercadeo
12211;Jefe mercadeo y ventas
12211;Jefe promoción de ventas
12211;Subgerente de mercadeo
12211;Subgerente de operaciones de ventas
12211;Subgerente ventas
12211;Vicepresidente de departamento comercial
12211;Vicepresidente de departamento mercadeo
12211;Vicepresidente de mercadeo aerolínea
12211;Vicepresidente de mercadeo cadena de almacenes
12211;Vicepresidente de mercadeo cadena de hoteles
12211;Vicepresidente de mercadeo entidades de salud educación y organizaciones de membresía
12211;Vicepresidente de mercadeo y ventas empresas de comercio medios de comunicación
12211;Vicepresidente de mercadeo y ventas empresas manufactureras de construcción y transporte
12211;Vicepresidente de operaciones empresas de comercio medios de comunicación
12211;Vicepresidente de ventas y mercadeo empresa manufacturera
12212;Administrador aduana
12212;Director comercio exterior
12212;Director de departamento de importaciones y exportaciones
12212;Director departamento internacional
12212;Director importaciones y exportaciones
12212;Gerente de departamento de comercio exterior
12212;Gerente de exportaciones
12212;Gerente de negocios internacionales
12212;Gerente de servicios de comercio exterior
12212;Jefe aduanas
12212;Jefe comercio exterior
12212;Jefe de departamento de comercio exterior
12212;Jefe de departamento de exportaciones
12212;Jefe de departamento de importaciones
12212;Jefe de operaciones aduaneras
12212;Jefe exportaciones
12212;Jefe importaciones
12220;Director comunicaciones y publicidad
12220;Director de departamento de publicidad
12220;Director de departamento de servicios publicitarios
12220;Director de relaciones públicas
12220;Director publicaciones
12220;Director publicidad
12220;Director relaciones públicas e información
12220;Director servicios publicitarios
12220;Gerente de marca
12220;Gerente de publicidad
12220;Gerente de servicio al cliente
12220;Gerente medios y publicidad
12220;Gerente producto
12220;Gerente promoción
12220;Gerente publicaciones
12220;Jefe de departamento de publicidad
12220;Jefe de departamento de relaciones públicas
12220;Jefe de sección de medios publicitarios
12220;Jefe de sección de servicio al cliente
12220;Jefe medios publicitarios
12220;Jefe publicaciones
12220;Jefe publicidad
