23521;Profesor de personas con discapacidad física
23521;Profesor de personas con discapacidad mental
23521;Profesor de sordomudos
23521;Profesor educación básica secundaria educación especial
23522;Educador social
23522;Educador terapeuta
23522;Maestro de recuperación
23522;Pedagogo reeducador
23522;Pedagogo terapeuta
23522;Profesor de recuperación
23522;Promotor social reeducador
23530;Instructor de idiomas
23530;Instructor de instituto de idiomas
23530;Instructor inglés
23530;Maestro de inglés como segunda lengua
23530;Maestro de inglés como segundo idioma
23530;Maestro de lenguaje práctico
23530;Maestro de segunda lengua
23530;Maestro intensivo de idioma
23530;Profesor de enseñanza intensiva de idiomas
23530;Profesor de enseñanza para inmigrantes
23530;Profesor de enseñanza práctica de idiomas
23530;Profesor de idioma particular
23530;Profesor de inglés como lengua extranjera
23530;Profesor de inglés escuela de idiomas
23530;Profesor de inglés particular
23530;Profesor de segunda lengua
23530;Profesor especializado en educación para migrantes
23530;Profesor inglés
23530;Tutor de idioma en clases particulares
23530;Tutor de lenguas después de la escuela
23540;Entrenador vocal
23540;Maestro de canto en clases particulares
23540;Maestro de guitarra en clases particulares
23540;Maestro de música en clases particulares
23540;Maestro de piano en clases particulares
23540;Maestro de violín en clases particulares
23540;Monitor en clases particulares de canto
23540;Monitor en clases particulares de música
23540;Profesor de arpa en clases particulares
23540;Profesor de canto en clases particulares
23540;Profesor de cuerdas frotadas en clases particulares, virtuales o en aula
23540;Profesor de cuerdas pulsadas en clases particulares, virtuales o en aula
23540;Profesor de educación informal en la práctica de bandas, nivel básico, en escuelas, academias de música
23540;Profesor de educación informal en la práctica de bandas, nivel medio, en escuelas, academias de música
23540;Profesor de educación informal en la práctica de coros, nivel básico, en escuelas, academias de música
23540;Profesor de educación informal en la práctica de coros, nivel medio, en escuelas, academias de música
23540;Profesor de educación informal en la práctica de músicas urbanas, nivel básico, en escuelas, academias de música
23540;Profesor de educación informal en la práctica de músicas urbanas, nivel medio, en escuelas, academias de música
23540;Profesor de educación informal en la práctica de orquesta sinfónica, nivel básico en escuelas, academias de música
23540;Profesor de educación informal en la práctica de orquesta sinfónica, nivel medio en escuelas, academias de música
23540;Profesor de guitarra en clases particulares
23540;Profesor de iniciación musical en escuelas, academias de música
23540;Profesor de instrumentos de percusión en clases particulares
23540;Profesor de instrumentos de viento madera en clases particulares
23540;Profesor de instrumentos de viento metal en clases particulares
23540;Profesor de música en clases particulares
23540;Profesor de música privado
23540;Profesor de músicas tradicionales de bandas de flautas, tambores y violines caucanos
23540;Profesor de músicas tradicionales de la trova y parranda de la región noroccidente de Colombia
23540;Profesor de músicas tradicionales de las islas
23540;Profesor de músicas tradicionales de las músicas de torbellino y canto de la región andina nororiente de Colombia
23540;Profesor de músicas tradicionales de los llanos
23540;Profesor de músicas tradicionales de marimba del pacífico sur
23540;Profesor de músicas tradicionales de pitos y tambores de la costa norte de Colombia
23540;Profesor de músicas tradicionales de rajaleña, cucamba de la región centro sur de Colombia
23540;Profesor de músicas tradicionales del conjunto de músicas de acordeón
23540;Profesor de músicas tradicionales del trapecio amazónico
23540;Profesor de piano en clases particulares
23540;Profesor de violín en clases particulares
23540;Tutor de arpa en clases particulares, virtuales o en aula
23540;Tutor de cuerdas frotadas en clases particulares, virtuales o en aula
23540;Tutor de cuerdas pulsadas en clases particulares, virtuales o en aula
23540;Tutor de instrumentos de percusión en clases particulares, virtuales o en aula
23540;Tutor de instrumentos de viento madera en clases particulares, virtuales o en aula
23540;Tutor de instrumentos de viento metal en clases particulares, virtuales o en aula
23540;Tutor de música en clases particulares
23540;Tutor de piano en clases particulares, virtuales o en aula
23540;Tutor en clases particulares de canto
23540;Tutor en clases particulares de música
23550;Artista formador
23550;Artista formador de artes
23550;Entrenador de actores
23550;Entrenador de actores de reparto
23550;Entrenador de actores infantiles
23550;Entrenador de baile deportivo
23550;Entrenador de combate escénico
23550;Entrenador de danza
23550;Entrenador de drama
23550;Formador en artes
23550;Instructor de danza
23550;Instructor de danza en clases particulares
23550;Instructor de danza y teatro
23550;Instructor de teatro
23550;Maestro arte (excepto educación básica y superior)
23550;Maestro de academia de baile
23550;Maestro de ballet
23550;Maestro de danza
23550;Maestro de danza en clases particulares
23550;Maestro de drama
23550;Maestro de drama en clases particulares
23550;Maestro de escultura
23550;Maestro de escultura en clases particulares
23550;Maestro de estudio de danza
23550;Maestro de pintura artística
23550;Maestro de pintura artística en clases particulares
23550;Preparador de actores
23550;Profesor de arte
23550;Profesor de arte dramático
23550;Profesor de arte dramático en clases particulares
23550;Profesor de arte particular
23550;Profesor de ballet
23550;Profesor de danza
23550;Profesor de danza en clases particulares
23550;Profesor de escultura
23550;Profesor de escultura en clases particulares
23550;Profesor de pintura artística
23550;Profesor de pintura artística en clases particulares
23550;Profesor de teatro
23550;Tutor de actuación
23550;Tutor de actuación en clases particulares
23550;Tutor de arte
23550;Tutor de arte en clases particulares
23550;Tutor de danza en clases particulares
23550;Tutor de pintura
23550;Tutor de pintura en clases particulares
23560;Consultor de capacitación en informática
23560;Consultor e instructor en tecnología de la información
23560;Instructor de escuela de informática
23560;Instructor de informática
23560;Instructor de internet
23560;Instructor de software
23560;Instructor de tecnologías de la información TI
23560;Instructor de telecomunicaciones e informática
23560;Instructor teleinformática
23560;Instructor virtualización de las TIC
23560;Profesor de sistemas
23591;Asesor de estudiantes
23591;Asesor de estudios
23591;Asesor estudiantil
23591;Consejero de escuela
23591;Consejero de universidad
23591;Consejero educativo
23591;Consejero escolar
23591;Consejero estudiantil
23591;Orientador educativo
23591;Orientador escolar
23591;Orientador vocacional
23599;Educador de correccional
23599;Entrenador de debates
23599;Instructor de matemáticas
23599;Instructor de matemáticas en clases particulares
23599;Maestro de correccional
23599;Profesor de alfabetización en clases particulares
23599;Profesor de correccional
23599;Profesor de matemáticas en clases particulares
23599;Profesor particular de educación formal
23599;Tutor de alfabetización en clases particulares
23599;Tutor de alfabetización y aritmética en clases particulares
23599;Tutor de artesanías en clases particulares
23599;Tutor de caligrafía
23599;Tutor de clases particulares
23599;Tutor de colegio de entrenamiento
23599;Tutor de corte y confección en clases particulares
23599;Tutor de elocución en clases particulares
23599;Tutor de matemáticas después de la escuela
23599;Tutor de matemáticas en clases particulares
23599;Tutor de química en clases particulares
24111;Asesor fiscal
24111;Cesionario de insolvencia
24111;Cesionario de quiebra
24111;Consultor de contabilidad
24111;Contable
24111;Contador
24111;Contador administrativo
24111;Contador certificado
24111;Contador de costos
24111;Contador de gestión
24111;Contador de impuestos
24111;Contador de inversiones financieras
24111;Contador de navío o nave
24111;Contador público
24111;Contador público financiero
24111;Contador tributario
24111;Controlador financiero
24111;Ecónomo tesorero
24111;Especialista en insolvencia
24111;Examinador de insolvencia
24111;Examinador de quiebra
24111;Fideicomisario de quiebra
24111;Fiduciario de insolvencia
24111;Interventor de cuentas
24111;Liquidador de empresa
24111;Liquidador financiero
24111;Liquidador oficial
24111;Profesional contabilidad y costos
24111;Profesional contable
24111;Profesional contable tributario
24111;Profesional de insolvencia
24111;Tesorero contable
24112;Auditor contable
24112;Auditor financiero
24112;Auditor financiero y contable
24112;Auditor forense
24112;Auditor general financiero y contable
24112;Auditor interno
24112;Consultor de auditoría
24112;Contador auditor
24112;Contralor auditor
24112;Especialista en auditoría
24112;Examinador de auditoría
24112;Oficial de cumplimiento SARLAFT y SAGRLAFT
24112;Revisor fiscal
24120;Asesor de deuda
24120;Asesor de gestión de patrimonio
24120;Asesor de inversiones
24120;Asesor de jubilación
24120;Asesor de negocios institucional pymes
24120;Asesor de pensiones
24120;Asesor de servicios financieros
24120;Asesor financiero
24120;Asistente fiduciario y de entidades financieras
24120;Consultor de pensiones
24120;Consultor de propiedad en inversión
24120;Consultor en asesoramiento financiero
24120;Consultor financiero
24120;Consultor y asesor a los clientes en inversión
24120;Consultor y asesor de jubilación
24120;Planificador de bienes raíces
24120;Planificador de patrimonio inmobiliario
24120;Planificador financiero
24130;Analista agente de inversiones y finanzas
24130;Analista de bonos
24130;Analista de impuestos
24130;Analista de inversiones
24130;Analista de negocios fiduciarios
24130;Analista de renta fija
24130;Analista de valores
24130;Analista financiero
24130;Analista financiero de inversiones
24130;Analista y agente de inversiones
24130;Consultor de análisis financiero de inversión
24130;Consultor de valores
24210;Analista administrativo
24210;Analista de clima y cultura organizacional
24210;Analista de costos
24210;Analista de costos y economía financiera
24210;Analista de cultura organizacional
24210;Analista de desarrollo organizacional
24210;Analista de gestión
24210;Analista de gestión del cambio organizacional
24210;Analista de métodos y procedimientos
24210;Analista de organización y métodos
24210;Analista de producción
24210;Analista de tiempos y movimientos
24210;Analista organizacional
24210;Asesor de empresas
24210;Consultor administrativo
24210;Consultor de gestión
24210;Consultor de negocios
24210;Consultor empresarial
24210;Consultor organizacional
24210;Especialista en eficiencia empresarial
24210;Facilitador de calidad
24210;Inspector de calidad de servicios
24210;Profesional de diseño y desarrollo organizacional
24210;Profesional organización y administración de las empresas
24220;Analista de estrategia de políticas
24220;Analista de inteligencia de política
24220;Analista de política gubernamental de tesorería
24220;Analista de política laboral
24220;Analista de políticas
24220;Analista de políticas de vivienda
24220;Analista de seguridad política
24220;Analista político
24220;Asesor asuntos intergubernamentales
24220;Asesor de política pública
24220;Asesor político
24220;Censurador de gobierno
24220;Censurador de películas
24220;Consultor de planificación de la atención de salud
24220;Consultor de política de seguridad
24220;Consultor de política social
24220;Consultor de programas de salud
24220;Coordinador programas y política social
24220;Especialista en investigación parlamentaria
24220;Especialista en política de seguridad
24220;Especialista en política pública
24220;Funcionario de inteligencia de políticas
24220;Funcionario de programas y política de salud
24220;Funcionario de programas y política educativa
24220;Funcionario de programas y política social
24220;Investigador analista de política de salud
24220;Investigador de desarrollo o análisis de la política del gobierno
24220;Investigador de políticas de la salud
24220;Investigador de programas y política de salud
24220;Investigador de revisión de políticas
24220;Investigador, consultor y funcionario de políticas sociales de salud y de educación
24220;Oficial de inteligencia de políticas
24220;Planificador social
24220;Profesional en políticas de administración
24231;Analista de empleos
24231;Analista de estudio del trabajo
24231;Analista de gestión humana
24231;Analista de ocupaciones
24231;Analista de puestos de trabajo
24231;Analista de salarios
24231;Analista de selección
24231;Analista de talento humano
24231;Analista de trabajo
24231;Analista ocupacional
24231;Árbitro de relaciones laborales
24231;Asesor de carreras
24231;Asesor de recursos humanos
24231;Asesor de relaciones laborales
24231;Conciliador de relaciones laborales
24231;Conciliador en el lugar de trabajo
24231;Conciliador laboral
24231;Consultor de personal
24231;Consultor de reclutamiento
24231;Consultor de recursos humanos
24231;Entrevistador para empleo
24231;Especialista de personal
24231;Especialista en reclutamiento
24231;Especialista en reclutamiento ejecutivo
24231;Especialista en relaciones laborales
24231;Experto en recursos humanos
24231;Funcionario de reclutamiento y selección de personal
24231;Mediador laboral
24231;Profesional de gestión de talento humano
24231;Profesional de recursos humanos
24231;Profesional de selección
24231;Profesional de talento humano
24231;Profesional en gestión humana
24232;Asesor de empleo
24232;Asesor de orientación profesional
24232;Cazatalentos
24232;Consejero de adaptación laboral
24232;Consejero de empleo
24232;Consejero de orientación profesional
24232;Consejero de readaptación laboral
24232;Consejero de servicios de empleo
24232;Consejero educativo de orientación vocacional
24232;Consejero ocupacional
24232;Consultor de empleo
24232;Especialista en orientación profesional
24232;Experto en recolocación
24232;Experto en recolocación laboral
24241;Asesor de capacitación
24241;Consultor de formación y desarrollo de personal
24241;Coordinador de capacitación
24241;Entrenador ejecutivo
24241;Especialista en desarrollo de fuerza de trabajo
24241;Especialista en desarrollo de fuerza laboral
24241;Especialista en desarrollo de personal
24241;Funcionario de desarrollo de personal
24241;Funcionario de entrenamiento
24241;Instructor de desarrollo de personal
24241;Profesional de desarrollo de personal
24241;Profesional de formación
24242;Analista evaluador de desempeño
24242;Consultor de competencias laborales
24242;Evaluador de competencias laborales
24311;Analista de comportamiento del consumidor
24311;Analista de datos de mercado
24311;Analista de estudio de mercados
24311;Analista de investigación de mercados
24311;Analista de mercadeo
24311;Analista de mercados
24311;Asesor de mercadeo
24311;Asesor de publicidad
24311;Autor publicitario
24311;Consultor de desarrollo comercial
24311;Consultor de investigación de mercado
24311;Consultor de mercadeo
24311;Consultor de mercados
24311;Consultor de publicidad
24311;Consultor publicista
24311;Creativo de publicidad
24311;Ejecutivo de cuenta en mercadeo
24311;Ejecutivo de cuenta en publicidad
24311;Ejecutivo de cuenta publicitaria
24311;Especialista en comercialización
24311;Especialista en mercadeo
24311;Especialista en métodos de promoción en ventas
24311;Especialista en publicidad
24311;Estratega publicista
24311;Gerente de cuenta de ventas
24311;Gerente de cuenta en mercadeo
24311;Gerente de cuenta en publicidad
24311;Investigador de mercado
24311;Investigador de mercados
24311;Mercadotecnista
24311;Profesional de comercialización
24311;Profesional de la publicidad y la comercialización
24311;Publicista
24311;Publicista de música
24311;Redactor de anuncios publicitarios
24311;Redactor de campañas publicitarias
24311;Redactor publicitario
24311;Research marketing analysts
24312;Administrador de comunidades virtuales
24312;Administrador de contenidos
24312;Administrador de contenidos literarios para comunidades virtuales
24312;Administrador de redes sociales
24312;Asesor en marketing digital para artistas
24312;Chief content officer
24312;Community manager
24312;Content manager
24312;Cool hunter
24312;Generador de contenidos virtuales
24312;Gestor de contenidos virtuales
24312;Gestor de la comunidad de internet
24312;Gestor de mercadeo digital y redes sociales
24312;Influencer
24312;Influenciador
24312;Jefe de contenidos virtuales
24312;Jefe de redes sociales
24312;Social media manager
24312;Social media strategist
24312;Youtuber
24313;Analista de negocios internacionales
24313;Profesional en negocios internacionales
24320;Agente promotor de relaciones públicas
24320;Analista de comunicaciones excepto de ordenadores
24320;Analista de relaciones interinstitucionales
24320;Analista de relaciones internacionales
24320;Asesor de comunicaciones
24320;Cabildero
24320;Consultor de comunicaciones
24320;Consultor de relaciones públicas
24320;Coordinador de medios de comunicación
24320;Ejecutivo de cuenta de relaciones públicas
24320;Escritor de promoción de relaciones públicas
24320;Especialista en asuntos públicos
24320;Especialista en enlace de prensa
24320;Especialista en información pública
24320;Especialista en relaciones públicas
24320;Funcionario de enlace de prensa
24320;Funcionario de relaciones públicas
24320;Gerente de cuenta de relaciones públicas
24320;Planner de medios
24320;Profesional de relaciones públicas
24320;Profesional en relaciones públicas y comunicaciones
24320;Promotor de relaciones públicas
24320;Redactor de promoción de relaciones públicas
24320;Redactor de relaciones públicas
24320;Relacionista público
24320;Relator de relaciones públicas
24320;Secretario de prensa
24330;Agente de ventas de ingeniería
24330;Agente de ventas médicas
24330;Agente de ventas técnicas
24330;Agente de ventas técnicas excepto las TIC
24330;Asesor de ventas técnicas excepto las TIC
24330;Asesor técnico comercial
24330;Asesor ventas técnicas
24330;Asesor ventas técnicas en el área de salud
24330;Consultor de ventas de ingeniería
24330;Consultor de ventas técnicas excepto las TIC
24330;Ejecutivo de cuenta de ventas de productos farmacéuticos
24330;Ejecutivo de cuenta de ventas de productos industriales
24330;Ejecutivo de cuenta de ventas de productos médicos
24330;Ejecutivo de cuenta de ventas técnicas
24330;Ejecutivo de cuenta de ventas técnicas excepto las TIC
24330;Ejecutivo de ventas de ventas técnicas
24330;Gerente de cuenta de ventas de productos farmacéuticos
24330;Gerente de cuenta de ventas de productos industriales
24330;Gerente de cuenta de ventas de productos médicos
24330;Gestor de propuestas comerciales
24330;Ingeniero de ventas excepto las TIC
24330;Profesional de ventas médicas
24330;Profesional de ventas técnicas excepto las TIC
24330;Representante de ventas de equipos de construcción
24330;Representante de ventas de ingeniería
24330;Representante de ventas de instrumental médico
24330;Representante de ventas de maquinaria pesada
24330;Representante de ventas de productos industriales
24330;Representante de ventas de productos médicos y farmacéuticos
24330;Representante de ventas médicas
24330;Representante de ventas técnicas
24330;Representante de ventas técnicas excepto las TIC
24330;Supervisor de ventas técnicas
24330;Supervisor de ventas técnicas excepto las TIC
24330;Vendedor de ingeniería
24330;Vendedor de maquinaria
24330;Vendedor de suministros industriales
24330;Vendedor de ventas técnicas
24330;Vendedor de ventas técnicas excepto las TIC
24330;Vendedor transferencista
24330;Visitador médico
24340;Agente de ventas de sistemas de computación
24340;Agente de ventas de tecnología de la información
24340;Agente de ventas de tecnología de las comunicaciones
24340;Agente de ventas técnicas de TIC
24340;Asesor de ventas técnicas de TIC
24340;Consultor de ventas de sistemas informáticos
24340;Consultor de ventas de tecnologías de la información
24340;Consultor de ventas técnicas de TIC
24340;Ejecutivo de cuenta de ventas de tecnología de la información y las comunicaciones
24340;Ejecutivo de cuenta de ventas técnicas de las TIC
24340;Ejecutivo de ventas de tecnología de la información y las comunicaciones
24340;Gerente de cuenta de las TIC
24340;Gerente de cuenta de tecnología informática
24340;Gerente de cuenta de ventas de tecnología de la información y las comunicaciones
24340;Gerente de desarrollo de negocios de las TIC
24340;Gestor de proveedores de TI
24340;Ingeniero de ventas de TIC
24340;Profesional de ventas de tecnología de la información y las comunicaciones
24340;Representante de ventas de computadores
24340;Representante de ventas de equipos de comunicación
24340;Representante de ventas de las TIC
24340;Representante de ventas de sistemas informáticos
24340;Representante de ventas de software
24340;Representante de ventas de tecnologías de la información
24340;Representante de ventas de tecnologías de las comunicaciones
24340;Representante de ventas técnicas de TIC
24340;Supervisor de ventas técnicas de TIC
24340;Vendedor de sistemas informáticos
24340;Vendedor de tecnología de la información
24340;Vendedor de tecnología de las comunicaciones
24340;Vendedor de ventas técnicas de TIC
25110;Analista de analytics
25110;Analista de diseño de sistemas empresariales
25110;Analista de empresas TIC
25110;Analista de evaluación de proyectos de TI
25110;Analista de gestión de cambio TI
25110;Analista de información comercial
25110;Analista de informática
25110;Analista de inteligencia de negocio TI
25110;Analista de inteligencia de negocios
25110;Analista de negocio y procesos TI
25110;Analista de negocios TI
25110;Analista de power BI
25110;Analista de procesamiento de información
25110;Analista de proyecto TI
25110;Analista de servicio de soporte TI
25110;Analista de sistemas
25110;Analista de sistemas de computadores
25110;Analista de sistemas de información
25110;Analista de sistemas de ordenadores
25110;Analista de sistemas informáticos
25110;Analista de ti tecnologías de la información empresariales
25110;Analista de transformación digital
25110;Analista en desarrollo de software
25110;Analista especificador de soporte TI
25110;Analista informático para análisis de negocio
25110;Analista procesamiento información TI
25110;Analista SAP
25110;Arquitecto de información para análisis de negocio
25110;Arquitecto de soluciones de negocios
25110;Arquitecto de soluciones empresariales
25110;Arquitecto empresarial para análisis de negocio
25110;Business Analyst
25110;Científico informático
25110;Consultor de negocios de tecnologías de la información
25110;Consultor de sistemas
25110;Consultor de sistemas informáticos
25110;Consultor de transformación digital
25110;Consultor TI
25110;Desarrollador de negocios
25110;Diseñador de sistemas de las TIC
25110;Diseñador de sistemas informáticos
25110;Diseñador de sistemas TI
25110;Especialista en inteligencia comercial
25110;Gestor de riesgos de TI
25110;Informático
25110;Ingeniero de análisis y diseño de sistemas
25110;Ingeniero de procesos de negocio de tecnología de la información
25110;Ingeniero de requerimientos TI
25110;Ingeniero de sistemas análisis y diseño
25110;Ingeniero de soporte computación
25110;Ingeniero en tecnologías de la información
25110;Tecnólogo de información en análisis de negocio
25110;Tecnólogo de informática
25120;Analista de aplicaciones de sistemas informáticos
25120;Analista de desarrollo tecnológico
25120;Analista de programas informáticos
25120;Analista de sistemas informáticos aplicaciones
25120;Analista de software
25120;Analista programador
25120;Analista programador sénior
25120;Arquitecto de software
25120;Creador de software
25120;Desarrollador de aplicaciones informáticas
25120;Desarrollador de aplicaciones informáticas excepto web
25120;Desarrollador de aplicaciones informáticas y digitales
25120;Desarrollador de sistemas
25120;Desarrollador de sistemas de información TI
25120;Desarrollador de software
25120;Desarrollador de soluciones TI
25120;Diseñador de programas informáticos
25120;Diseñador de software
25120;Diseñador de software musical
25120;Diseñador de soluciones de software
25120;Ingeniero de aplicaciones por computador
25120;Ingeniero de cómputo
25120;Ingeniero de desarrollo informático
25120;Ingeniero de desarrollo software
25120;Ingeniero de sistemas
25120;Ingeniero de sistemas computacionales
25120;Ingeniero de sistemas e informática
25120;Ingeniero de sistemas informáticos
25120;Ingeniero de sistemas y computación
25120;Ingeniero de sistemas, informática y computación
25120;Ingeniero de software
25120;Ingeniero de software computacional
25120;Ingeniero de software y comunicaciones
25120;Líder de desarrollo TI
25120;Líder desarrollador funcional TI
25120;Programador analista
25120;Tecnólogo en análisis y desarrollo de sistemas de información
25120;Tecnólogo en análisis y desarrollo de software
25130;Arquitecto de información computable de sitios web
25130;Arquitecto de información web
25130;Arquitecto de sitios web
25130;Arquitecto web
25130;Consultor de desarrollo de sitios web
25130;Consultor de internet de desarrollo de sitios web
25130;Consultor de internet de programación
25130;Consultor de programación web
25130;Desarrollador de aplicaciones computacionales en internet
